"Steven and Greg take Lapis Lazuli on a boat ride to help her recover from her trauma. However, Jasper follows them and confronts Lapis, seeking to fuse into Malachite again.","Steven and Greg take Lapis Lazuli on a boat ride to help her recover from her trauma. However, Jasper follows them and confronts Lapis, seeking to fuse into Malachite again.","Steven and Greg take Lapis Lazuli on a boat ride to help her recover from her trauma. However, Jasper follows them and confronts Lapis, seeking to fuse into Malachite again.","Steven and Greg take Lapis Lazuli on a boat ride to help her recover from her trauma. However, Jasper follows them and confronts Lapis, seeking to fuse into Malachite again.","Steven and Greg take Lapis Lazuli on a boat ride to help her recover from her trauma. However, Jasper follows them and confronts Lapis, seeking to fuse into Malachite again.","Steven and Greg take Lapis Lazuli on a boat ride to help her recover from her trauma. However, Jasper follows them and confronts Lapis, seeking to fuse into Malachite again.","Steven and Greg take Lapis Lazuli on a boat ride to help her recover from her trauma. However, Jasper follows them and confronts Lapis, seeking to fuse into Malachite again.","Steven and Greg take Lapis Lazuli on a boat ride to help her recover from her trauma. However, Jasper follows them and confronts Lapis, seeking to fuse into Malachite again."
94,16,"""Greg the Babysitter""",Joe Johnston (supervising)Jasmin Lai (art),Lamar Abrams and Katie Mitroff,"July 29, 2016",1031-095,1.31[98]
"When Steven asks Greg how he started working at the car wash, Greg tells Steven about a day he and Rose spent babysitting Sour Cream for Vidalia.","When Steven asks Greg how he started working at the car wash, Greg tells Steven about a day he and Rose spent babysitting Sour Cream for Vidalia.","When Steven asks Greg how he started working at the car wash, Greg tells Steven about a day he and Rose spent babysitting Sour Cream for Vidalia.","When Steven asks Greg how he started working at the car wash, Greg tells Steven about a day he and Rose spent babysitting Sour Cream for Vidalia.","When Steven asks Greg how he started working at the car wash, Greg tells Steven about a day he and Rose spent babysitting Sour Cream for Vidalia.","When Steven asks Greg how he started working at the car wash, Greg tells Steven about a day he and Rose spent babysitting Sour Cream for Vidalia.","When Steven asks Greg how he started working at the car wash, Greg tells Steven about a day he and Rose spent babysitting Sour Cream for Vidalia.","When Steven asks Greg how he started working at the car wash, Greg tells Steven about a day he and Rose spent babysitting Sour Cream for Vidalia."
95,17,"""Gem Hunt""",Joe Johnston (supervising)Jasmin Lai (art),Colin Howard and Jeff Liu,"August 1, 2016",1031-096,1.64[99]
"Connie goes on her first mission with Steven and Pearl to find a corrupted Gem monster in the Great North, only to find two monsters being targeted by Jasper.","Connie goes on her first mission with Steven and Pearl to find a corrupted Gem monster in the Great North, only to find two monsters being targeted by Jasper.","Connie goes on her first mission with Steven and Pearl to find a corrupted Gem monster in the Great North, only to find two monsters being targeted by Jasper.","Connie goes on her first mission with Steven and Pearl to find a corrupted Gem monster in the Great North, only to find two monsters being targeted by Jasper.","Connie goes on her first mission with Steven and Pearl to find a corrupted Gem monster in the Great North, only to find two monsters being targeted by Jasper.","Connie goes on her first mission with Steven and Pearl to find a corrupted Gem monster in the Great North, only to find two monsters being targeted by Jasper.","Connie goes on her first mission with Steven and Pearl to find a corrupted Gem monster in the Great North, only to find two monsters being targeted by Jasper.","Connie goes on her first mission with Steven and Pearl to find a corrupted Gem monster in the Great North, only to find two monsters being targeted by Jasper."
96,18,"""Crack the Whip""",Kat Morris (supervising)Jasmin Lai (art),Raven M. Molisee and Paul Villeco,"August 2, 2016",1031-097,1.90[100]
"When Garnet and Pearl return to the Great North to look for Jasper, Amethyst is put in charge of Steven and Connie. They continue their battle training together and try to have a fun day in Beach City, but are interrupted by the reappearance of Jasper.","When Garnet and Pearl return to the Great North to look for Jasper, Amethyst is put in charge of Steven and Connie. They continue their battle training together and try to have a fun day in Beach City, but are interrupted by the reappearance of Jasper.","When Garnet and Pearl return to the Great North to look for Jasper, Amethyst is put in charge of Steven and Connie. They continue their battle training together and try to have a fun day in Beach City, but are interrupted by the reappearance of Jasper.","When Garnet and Pearl return to the Great North to look for Jasper, Amethyst is put in charge of Steven and Connie. They continue their battle training together and try to have a fun day in Beach City, but are interrupted by the reappearance of Jasper.","When Garnet and Pearl return to the Great North to look for Jasper, Amethyst is put in charge of Steven and Connie. They continue their battle training together and try to have a fun day in Beach City, but are interrupted by the reappearance of Jasper.","When Garnet and Pearl return to the Great North to look for Jasper, Amethyst is put in charge of Steven and Connie. They continue their battle training together and try to have a fun day in Beach City, but are interrupted by the reappearance of Jasper.","When Garnet and Pearl return to the Great North to look for Jasper, Amethyst is put in charge of Steven and Connie. They continue their battle training together and try to have a fun day in Beach City, but are interrupted by the reappearance of Jasper.","When Garnet and Pearl return to the Great North to look for Jasper, Amethyst is put in charge of Steven and Connie. They continue their battle training together and try to have a fun day in Beach City, but are interrupted by the reappearance of Jasper."
97,19,"""Steven vs. Amethyst""",Kat Morris (supervising)Jasmin Lai (art),Hilary Florido and Jesse Zuke,"August 3, 2016",1031-098,1.74[101]
"Following the events of the previous episode, Amethyst's self-esteem has hit rock bottom. With Steven's rising power, Amethyst begins to suspect that she is now the weakest Gem on the team. This leads Steven and Amethyst to engage in a duel to see who really is the weakest Gem.","Following the events of the previous episode, Amethyst's self-esteem has hit rock bottom. With Steven's rising power, Amethyst begins to suspect that she is now the weakest Gem on the team. This leads Steven and Amethyst to engage in a duel to see who really is the weakest Gem.","Following the events of the previous episode, Amethyst's self-esteem has hit rock bottom. With Steven's rising power, Amethyst begins to suspect that she is now the weakest Gem on the team. This leads Steven and Amethyst to engage in a duel to see who really is the weakest Gem.","Following the events of the previous episode, Amethyst's self-esteem has hit rock bottom. With Steven's rising power, Amethyst begins to suspect that she is now the weakest Gem on the team. This leads Steven and Amethyst to engage in a duel to see who really is the weakest Gem.","Following the events of the previous episode, Amethyst's self-esteem has hit rock bottom. With Steven's rising power, Amethyst begins to suspect that she is now the weakest Gem on the team. This leads Steven and Amethyst to engage in a duel to see who really is the weakest Gem.","Following the events of the previous episode, Amethyst's self-esteem has hit rock bottom. With Steven's rising power, Amethyst begins to suspect that she is now the weakest Gem on the team. This leads Steven and Amethyst to engage in a duel to see who really is the weakest Gem.","Following the events of the previous episode, Amethyst's self-esteem has hit rock bottom. With Steven's rising power, Amethyst begins to suspect that she is now the weakest Gem on the team. This leads Steven and Amethyst to engage in a duel to see who really is the weakest Gem.","Following the events of the previous episode, Amethyst's self-esteem has hit rock bottom. With Steven's rising power, Amethyst begins to suspect that she is now the weakest Gem on the team. This leads Steven and Amethyst to engage in a duel to see who really is the weakest Gem."
9899[nb 9],2021,"""Bismuth""",Joe Johnston (supervising)Jasmin Lai (art),"Lamar Abrams, Colin Howard, Jeff Liu, and Katie Mitroff","August 4, 2016",1031-0991031-100,2.15[102]
"Bismuth, one of the original Crystal Gems, is accidentally freed by Steven from a bubble inside Lion's mane. She is welcomed back with open arms by Pearl and Garnet, while Amethyst quickly warms up to her company. However, Steven soon notices that Bismuth's outlook on the rebellion is radically different from the other Gems' when she shows eagerness to re-ignite the Gem War with an unethical secret weapon.","Bismuth, one of the original Crystal Gems, is accidentally freed by Steven from a bubble inside Lion's mane. She is welcomed back with open arms by Pearl and Garnet, while Amethyst quickly warms up to her company. However, Steven soon notices that Bismuth's outlook on the rebellion is radically different from the other Gems' when she shows eagerness to re-ignite the Gem War with an unethical secret weapon.","Bismuth, one of the original Crystal Gems, is accidentally freed by Steven from a bubble inside Lion's mane. She is welcomed back with open arms by Pearl and Garnet, while Amethyst quickly warms up to her company. However, Steven soon notices that Bismuth's outlook on the rebellion is radically different from the other Gems' when she shows eagerness to re-ignite the Gem War with an unethical secret weapon.","Bismuth, one of the original Crystal Gems, is accidentally freed by Steven from a bubble inside Lion's mane. She is welcomed back with open arms by Pearl and Garnet, while Amethyst quickly warms up to her company. However, Steven soon notices that Bismuth's outlook on the rebellion is radically different from the other Gems' when she shows eagerness to re-ignite the Gem War with an unethical secret weapon.","Bismuth, one of the original Crystal Gems, is accidentally freed by Steven from a bubble inside Lion's mane. She is welcomed back with open arms by Pearl and Garnet, while Amethyst quickly warms up to her company. However, Steven soon notices that Bismuth's outlook on the rebellion is radically different from the other Gems' when she shows eagerness to re-ignite the Gem War with an unethical secret weapon.","Bismuth, one of the original Crystal Gems, is accidentally freed by Steven from a bubble inside Lion's mane. She is welcomed back with open arms by Pearl and Garnet, while Amethyst quickly warms up to her company. However, Steven soon notices that Bismuth's outlook on the rebellion is radically different from the other Gems' when she shows eagerness to re-ignite the Gem War with an unethical secret weapon.","Bismuth, one of the original Crystal Gems, is accidentally freed by Steven from a bubble inside Lion's mane. She is welcomed back with open arms by Pearl and Garnet, while Amethyst quickly warms up to her company. However, Steven soon notices that Bismuth's outlook on the rebellion is radically different from the other Gems' when she shows eagerness to re-ignite the Gem War with an unethical secret weapon.","Bismuth, one of the original Crystal Gems, is accidentally freed by Steven from a bubble inside Lion's mane. She is welcomed back with open arms by Pearl and Garnet, while Amethyst quickly warms up to her company. However, Steven soon notices that Bismuth's outlook on the rebellion is radically different from the other Gems' when she shows eagerness to re-ignite the Gem War with an unethical secret weapon."
100,22,"""Beta"" (Part 1)",Kat Morris (supervising)Ricky Cometa (art),Hilary Florido and Jesse Zuke,"August 8, 2016[nb 10]",1031-101,1.99[103]
"With Amethyst obsessing over her loss to Jasper, Steven takes her to visit Peridot and Lapis Lazuli at the barn. Peridot and Lapis show off their attempts at creating art (which they call ""meepmorps""). When that fails to cheer Amethyst up, Peridot takes her and Steven to Jasper's birthplace, a heavily rushed and poorly-made Kindergarten, where they discover Jasper is the only perfectly-formed Gem made at that site.","With Amethyst obsessing over her loss to Jasper, Steven takes her to visit Peridot and Lapis Lazuli at the barn. Peridot and Lapis show off their attempts at creating art (which they call ""meepmorps""). When that fails to cheer Amethyst up, Peridot takes her and Steven to Jasper's birthplace, a heavily rushed and poorly-made Kindergarten, where they discover Jasper is the only perfectly-formed Gem made at that site.","With Amethyst obsessing over her loss to Jasper, Steven takes her to visit Peridot and Lapis Lazuli at the barn. Peridot and Lapis show off their attempts at creating art (which they call ""meepmorps""). When that fails to cheer Amethyst up, Peridot takes her and Steven to Jasper's birthplace, a heavily rushed and poorly-made Kindergarten, where they discover Jasper is the only perfectly-formed Gem made at that site.","With Amethyst obsessing over her loss to Jasper, Steven takes her to visit Peridot and Lapis Lazuli at the barn. Peridot and Lapis show off their attempts at creating art (which they call ""meepmorps""). When that fails to cheer Amethyst up, Peridot takes her and Steven to Jasper's birthplace, a heavily rushed and poorly-made Kindergarten, where they discover Jasper is the only perfectly-formed Gem made at that site.","With Amethyst obsessing over her loss to Jasper, Steven takes her to visit Peridot and Lapis Lazuli at the barn. Peridot and Lapis show off their attempts at creating art (which they call ""meepmorps""). When that fails to cheer Amethyst up, Peridot takes her and Steven to Jasper's birthplace, a heavily rushed and poorly-made Kindergarten, where they discover Jasper is the only perfectly-formed Gem made at that site.","With Amethyst obsessing over her loss to Jasper, Steven takes her to visit Peridot and Lapis Lazuli at the barn. Peridot and Lapis show off their attempts at creating art (which they call ""meepmorps""). When that fails to cheer Amethyst up, Peridot takes her and Steven to Jasper's birthplace, a heavily rushed and poorly-made Kindergarten, where they discover Jasper is the only perfectly-formed Gem made at that site.","With Amethyst obsessing over her loss to Jasper, Steven takes her to visit Peridot and Lapis Lazuli at the barn. Peridot and Lapis show off their attempts at creating art (which they call ""meepmorps""). When that fails to cheer Amethyst up, Peridot takes her and Steven to Jasper's birthplace, a heavily rushed and poorly-made Kindergarten, where they discover Jasper is the only perfectly-formed Gem made at that site.","With Amethyst obsessing over her loss to Jasper, Steven takes her to visit Peridot and Lapis Lazuli at the barn. Peridot and Lapis show off their attempts at creating art (which they call ""meepmorps""). When that fails to cheer Amethyst up, Peridot takes her and Steven to Jasper's birthplace, a heavily rushed and poorly-made Kindergarten, where they discover Jasper is the only perfectly-formed Gem made at that site."
101,23,"""Earthlings"" (Part 2)",Kat Morris (supervising)Ricky Cometa (art),Raven M. Molisee and Paul Villeco,"August 8, 2016",1031-102,1.99[103]
"Amethyst fights Jasper but cannot get the upper hand until, in a moment of commiseration with Steven, she fuses with him into Smoky Quartz. Jasper's rash decision to retaliate by fusing with a corrupted Gem results in her being corrupted herself.","Amethyst fights Jasper but cannot get the upper hand until, in a moment of commiseration with Steven, she fuses with him into Smoky Quartz. Jasper's rash decision to retaliate by fusing with a corrupted Gem results in her being corrupted herself.","Amethyst fights Jasper but cannot get the upper hand until, in a moment of commiseration with Steven, she fuses with him into Smoky Quartz. Jasper's rash decision to retaliate by fusing with a corrupted Gem results in her being corrupted herself.","Amethyst fights Jasper but cannot get the upper hand until, in a moment of commiseration with Steven, she fuses with him into Smoky Quartz. Jasper's rash decision to retaliate by fusing with a corrupted Gem results in her being corrupted herself.","Amethyst fights Jasper but cannot get the upper hand until, in a moment of commiseration with Steven, she fuses with him into Smoky Quartz. Jasper's rash decision to retaliate by fusing with a corrupted Gem results in her being corrupted herself.","Amethyst fights Jasper but cannot get the upper hand until, in a moment of commiseration with Steven, she fuses with him into Smoky Quartz. Jasper's rash decision to retaliate by fusing with a corrupted Gem results in her being corrupted herself.","Amethyst fights Jasper but cannot get the upper hand until, in a moment of commiseration with Steven, she fuses with him into Smoky Quartz. Jasper's rash decision to retaliate by fusing with a corrupted Gem results in her being corrupted herself.","Amethyst fights Jasper but cannot get the upper hand until, in a moment of commiseration with Steven, she fuses with him into Smoky Quartz. Jasper's rash decision to retaliate by fusing with a corrupted Gem results in her being corrupted herself."
102,24,"""Back to the Moon""",Joe Johnston (supervising)Ricky Cometa (art),Lamar Abrams and Katie Mitroff,"August 9, 2016",1031-103,1.45[104]
"The dispatch team of Rubies have returned to the barn still searching for Jasper. To try to get rid of them once again, Amethyst impersonates Jasper, but things go awry when the Rubies take her and the other Crystal Gems to contact Yellow Diamond at the Moon Base. While there, Steven learns a shocking fact about his mother, Rose Quartz.","The dispatch team of Rubies have returned to the barn still searching for Jasper. To try to get rid of them once again, Amethyst impersonates Jasper, but things go awry when the Rubies take her and the other Crystal Gems to contact Yellow Diamond at the Moon Base. While there, Steven learns a shocking fact about his mother, Rose Quartz.","The dispatch team of Rubies have returned to the barn still searching for Jasper. To try to get rid of them once again, Amethyst impersonates Jasper, but things go awry when the Rubies take her and the other Crystal Gems to contact Yellow Diamond at the Moon Base. While there, Steven learns a shocking fact about his mother, Rose Quartz.","The dispatch team of Rubies have returned to the barn still searching for Jasper. To try to get rid of them once again, Amethyst impersonates Jasper, but things go awry when the Rubies take her and the other Crystal Gems to contact Yellow Diamond at the Moon Base. While there, Steven learns a shocking fact about his mother, Rose Quartz.","The dispatch team of Rubies have returned to the barn still searching for Jasper. To try to get rid of them once again, Amethyst impersonates Jasper, but things go awry when the Rubies take her and the other Crystal Gems to contact Yellow Diamond at the Moon Base. While there, Steven learns a shocking fact about his mother, Rose Quartz.","The dispatch team of Rubies have returned to the barn still searching for Jasper. To try to get rid of them once again, Amethyst impersonates Jasper, but things go awry when the Rubies take her and the other Crystal Gems to contact Yellow Diamond at the Moon Base. While there, Steven learns a shocking fact about his mother, Rose Quartz.","The dispatch team of Rubies have returned to the barn still searching for Jasper. To try to get rid of them once again, Amethyst impersonates Jasper, but things go awry when the Rubies take her and the other Crystal Gems to contact Yellow Diamond at the Moon Base. While there, Steven learns a shocking fact about his mother, Rose Quartz.","The dispatch team of Rubies have returned to the barn still searching for Jasper. To try to get rid of them once again, Amethyst impersonates Jasper, but things go awry when the Rubies take her and the other Crystal Gems to contact Yellow Diamond at the Moon Base. While there, Steven learns a shocking fact about his mother, Rose Quartz."
103,25,"""Bubbled""",Joe Johnston (supervising)Ricky Cometa (art),Colin Howard and Jeff Liu,"August 10, 2016",1031-104,1.57[105]
"After being sucked out of the Moon Base's airlock with the Rubies, bubbling himself to safely float through space, Steven has a life-and-death encounter with the murderous Ruby he nicknamed Eyeball.","After being sucked out of the Moon Base's airlock with the Rubies, bubbling himself to safely float through space, Steven has a life-and-death encounter with the murderous Ruby he nicknamed Eyeball.","After being sucked out of the Moon Base's airlock with the Rubies, bubbling himself to safely float through space, Steven has a life-and-death encounter with the murderous Ruby he nicknamed Eyeball.","After being sucked out of the Moon Base's airlock with the Rubies, bubbling himself to safely float through space, Steven has a life-and-death encounter with the murderous Ruby he nicknamed Eyeball.","After being sucked out of the Moon Base's airlock with the Rubies, bubbling himself to safely float through space, Steven has a life-and-death encounter with the murderous Ruby he nicknamed Eyeball.","After being sucked out of the Moon Base's airlock with the Rubies, bubbling himself to safely float through space, Steven has a life-and-death encounter with the murderous Ruby he nicknamed Eyeball.","After being sucked out of the Moon Base's airlock with the Rubies, bubbling himself to safely float through space, Steven has a life-and-death encounter with the murderous Ruby he nicknamed Eyeball.","After being sucked out of the Moon Base's airlock with the Rubies, bubbling himself to safely float through space, Steven has a life-and-death encounter with the murderous Ruby he nicknamed Eyeball."
